{
  "schema": "sico.semantic-query.v0",
  "protocol_version": 0,
  "request_id": "q-describe-transition",
  "snapshot_id": "fixture:semantic-query-v0",
  "operation": "describe",
  "target": { "id": "sico://examples/order-state/function/transition" },
  "options": { "max_depth": 1, "max_items": 16, "max_bytes": 16384, "include_private": true, "include_source": false, "transitive": false }
}
