{
  "schema": "sico.semantic-query.v0",
  "protocol_version": 0,
  "request_id": "q-impact-order-status",
  "snapshot_id": "fixture:semantic-query-v0",
  "operation": "impact",
  "target": { "id": "sico://examples/order-state/enum/OrderStatus" },
  "parameters": { "change": { "kind": "type", "summary": "add Refunded variant" } },
  "options": { "max_depth": 3, "max_items": 16, "max_bytes": 32768, "include_private": true, "include_source": false, "transitive": true }
}
