{
  "schema": "sico.semantic-query.v0",
  "protocol_version": 0,
  "request_id": "q-slice-apply-transfer",
  "snapshot_id": "fixture:semantic-query-v0",
  "operation": "slice",
  "target": { "id": "sico://examples/account-transfer/function/apply_transfer" },
  "parameters": { "goal": "understand-behavior" },
  "options": { "max_depth": 2, "max_items": 16, "max_bytes": 32768, "include_private": true, "include_source": false, "transitive": true }
}
