{
  "schema": "sico.semantic-query.v0",
  "protocol_version": 0,
  "request_id": "q-outline-examples",
  "snapshot_id": "fixture:semantic-query-v0",
  "operation": "outline",
  "target": { "id": "sico://examples/package" },
  "options": { "max_depth": 1, "max_items": 16, "max_bytes": 32768, "include_private": false, "include_source": false, "transitive": false }
}
